"tool_name","category","description","keywords","icon_url","website_link"
"Suno AI","Audio Generation","Leading AI music creation platform generating complete songs with lyrics and instrumentation from simple text.","suno music audio generate create song lyrics melody composition text prompt full","https://suno.com/favicon.ico","https://suno.com"
"Boomy","Audio Generation","AI music generator that lets anyone create original songs in seconds and distribute them to streaming platforms.","boomy music generate create original song ai distribute stream publish fast","https://boomy.com/favicon.ico","https://boomy.com"
"Soundraw","Audio Generation","AI music generator for content creators producing royalty-free, customizable background music for videos.","soundraw music generate royalty free background video content creator customize","https://soundraw.io/favicon.ico","https://soundraw.io"
"Mubert","Audio Generation","AI-generated royalty-free music platform creating adaptive soundtracks for videos, streams, and apps.","mubert music generate royalty free adaptive soundtrack video stream app ambient","https://mubert.com/favicon.ico","https://mubert.com"
"AIVA","Audio Generation","AI composer creating emotional classical, cinematic, and game music for films, trailers, and soundtracks.","aiva ai compose music classical cinematic game film trailer soundtrack emotional","https://www.aiva.ai/favicon.ico","https://www.aiva.ai"
"Loudly","Audio Generation","AI music platform for generating and customizing background tracks for social media and video content.","loudly music generate customize background social video content creator ai loop","https://www.loudly.com/favicon.ico","https://www.loudly.com"
"Beatoven.ai","Audio Generation","AI music tool creating unique mood-based background tracks tailored to your video content automatically.","beatoven music generate mood background video content creator ai customize track","https://www.beatoven.ai/favicon.ico","https://www.beatoven.ai"
"Splash Pro","Audio Generation","AI music maker for creating and remixing beats, melodies, and full tracks with voice control and loops.","splash pro music create remix beat melody ai voice control loop track","https://www.splashmusic.com/favicon.ico","https://www.splashmusic.com"
"Musicfy","Audio Generation","AI voice-to-instrument tool that converts voice recordings into musical instruments and generates AI cover songs.","musicfy ai voice instrument convert cover song generate music audio create","https://musicfy.lol/favicon.ico","https://musicfy.lol"
"Voicemod","Audio Generation","Real-time AI voice changer and soundboard for gaming, streaming, and online communication with voice effects.","voicemod voice changer real-time ai effect gaming streaming online soundboard fun","https://www.voicemod.net/favicon.ico","https://www.voicemod.net"
"Resemble AI","Audio Generation","AI voice platform for cloning voices, generating speech, and creating interactive real-time voice agents.","resemble ai voice clone generate speech real-time agent interactive tts custom","https://www.resemble.ai/favicon.ico","https://www.resemble.ai"
"Play.ht","Audio Generation","AI text-to-speech platform with 900+ voices in 100+ languages for podcasts, videos, and content creation.","play.ht tts text speech voice generate podcast video content 900 voices language","https://play.ht/favicon.ico","https://play.ht"
"Speechify","Audio Generation","AI text-to-speech tool that reads documents, PDFs, and web pages aloud at up to 4.5x speed.","speechify text speech read document pdf listen speed ai accessibility audio","https://speechify.com/favicon.ico","https://speechify.com"
"Whisper","Audio Transcription","OpenAI's powerful open-source speech recognition model for accurate audio and video transcription.","whisper openai transcribe speech audio video recognition language convert open source","https://upload.wikimedia.org/wikipedia/commons/thumb/0/04/ChatGPT_logo.svg/64px-ChatGPT_logo.svg.png","https://openai.com/research/whisper"
"AssemblyAI","Audio Transcription","Developer API for accurate audio transcription, speaker detection, sentiment analysis, and audio intelligence.","assemblyai transcribe audio api speaker detect sentiment intelligence developer","https://www.assemblyai.com/favicon.ico","https://www.assemblyai.com"
"Deepgram","Audio Transcription","Real-time speech-to-text API for transcription, captioning, and voice features with low latency.","deepgram speech text transcribe api real-time caption voice recognize developer","https://deepgram.com/favicon.ico","https://deepgram.com"
"Krisp","Audio Generation","AI noise cancellation app removing background noise and echo from calls and recordings in real time.","krisp noise cancel remove background call recording real-time meeting ai clean","https://krisp.ai/favicon.ico","https://krisp.ai"
"Adobe Podcast","Audio Generation","Adobe's AI audio toolkit with Enhance Speech to remove noise and improve podcast and voice recording quality.","adobe podcast audio enhance speech noise remove quality improve record ai","https://podcast.adobe.com/favicon.ico","https://podcast.adobe.com"
"Cleanvoice","Audio Transcription","AI tool that automatically removes filler words, stutters, mouth sounds, and dead air from podcasts.","cleanvoice ai podcast audio remove filler stutter mouth sound dead air clean","https://cleanvoice.ai/favicon.ico","https://cleanvoice.ai"
"Podcastle","Audio Generation","All-in-one AI podcast creation platform for recording, editing, transcribing, and distributing episodes.","podcastle podcast create record edit transcribe distribute ai studio publish","https://podcastle.ai/favicon.ico","https://podcastle.ai"
"Descript Overdub","Audio Generation","AI voice cloning feature in Descript that generates your voice to fix podcast and video recording mistakes.","descript overdub voice clone fix podcast record mistake regenerate word replace","https://www.descript.com/favicon.ico","https://www.descript.com/overdub"
"Altered Studio","Audio Generation","Professional AI voice transformation tool for changing, cloning, and designing custom voices for productions.","altered studio voice transform clone design custom production ai professional change","https://www.altered.ai/favicon.ico","https://www.altered.ai"
"Lalal.ai","Audio Generation","AI audio stem splitter separating vocals, instruments, drums, and bass from any song with high quality.","lalal ai stem split vocal instrument drum bass separate song audio extract","https://www.lalal.ai/favicon.ico","https://www.lalal.ai"
"Moises","Audio Generation","AI music app for separating audio stems, changing pitch, adjusting tempo, and practicing with any song.","moises ai music stem separate pitch tempo practice song instrument vocal app","https://moises.ai/favicon.ico","https://moises.ai"
"AudioShake","Audio Generation","AI audio separation technology extracting clean stems from mixed music recordings for licensing and remixing.","audioshake stem separate music recording license remix clean extract vocal ai","https://www.audioshake.ai/favicon.ico","https://www.audioshake.ai"
"GitHub Copilot","Coding","AI pair programmer by GitHub and OpenAI suggesting code, functions, tests, and documentation in real time.","github copilot code programming autocomplete suggest debug developer ide function test","https://upload.wikimedia.org/wikipedia/commons/thumb/c/c2/GitHub_Invertocat_Logo.svg/64px-GitHub_Invertocat_Logo.svg.png","https://github.com/features/copilot"
"Cursor","Coding","AI-first code editor with deep codebase understanding, multi-file edits, and instant AI chat for developers.","cursor code editor programming ide ai pair programmer debug refactor codebase understand","https://cursor.sh/favicon.ico","https://cursor.sh"
"Tabnine","Coding","AI code assistant predicting and autocompleting code across 30+ languages and all major IDEs privately.","tabnine code autocomplete programming suggestion developer language ide private secure predict","https://www.tabnine.com/favicon.ico","https://www.tabnine.com"
"Replit","Coding","Online IDE with AI features for writing, running, debugging, and deploying code in any language from browser.","replit code online ide programming deploy run browser cloud development collaborative","https://replit.com/favicon.ico","https://replit.com"
"Amazon CodeWhisperer","Coding","AWS's AI coding companion suggesting real-time code completions and security vulnerability scanning.","amazon codewhisperer aws ai code suggest completion security scan cloud developer","https://aws.amazon.com/favicon.ico","https://aws.amazon.com/codewhisperer"
"Codeium","Coding","Free AI code completion and chat tool supporting 70+ languages with IDE plugins and enterprise security.","codeium free ai code complete chat language plugin ide enterprise security suggest","https://codeium.com/favicon.ico","https://codeium.com"
"Sourcegraph Cody","Coding","AI coding assistant with full codebase context for answering questions, fixing bugs, and writing code.","sourcegraph cody ai code codebase context question fix bug write understand enterprise","https://sourcegraph.com/favicon.ico","https://sourcegraph.com/cody"
"Continue","Coding","Open-source AI code assistant plugin for VS Code and JetBrains connecting any LLM to your IDE locally.","continue open source ai code plugin vscode jetbrains llm ide local private","https://continue.dev/favicon.ico","https://continue.dev"
"Aider","Coding","AI pair programming CLI tool that edits code in your local git repository using GPT-4 or Claude.","aider ai pair programming cli git local gpt claude edit code terminal command","https://aider.chat/favicon.ico","https://aider.chat"
"Devin","Coding","World's first fully autonomous AI software engineer capable of completing entire coding projects end-to-end.","devin ai software engineer autonomous coding project build end-to-end agent full-stack","https://www.cognition.ai/favicon.ico","https://www.cognition.ai"
"Bolt.new","Coding","AI-powered full-stack web app builder that generates, runs, and deploys complete apps from text prompts.","bolt new ai full-stack web app build generate deploy text prompt instant code","https://bolt.new/favicon.ico","https://bolt.new"
"v0 by Vercel","Coding","AI UI component generator by Vercel creating React and Tailwind code from text descriptions and screenshots.","v0 vercel ai ui component react tailwind generate code design text screenshot frontend","https://v0.dev/favicon.ico","https://v0.dev"
"Lovable","Coding","AI full-stack app builder that generates complete React applications from natural language descriptions.","lovable ai app builder react full-stack generate natural language frontend backend","https://lovable.dev/favicon.ico","https://lovable.dev"
"Windsurf","Coding","Codeium's agentic IDE with Cascade feature that understands and edits across entire codebases autonomously.","windsurf codeium agentic ide cascade codebase understand edit autonomous ai developer","https://codeium.com/favicon.ico","https://codeium.com/windsurf"
"Zed","Coding","High-performance collaborative code editor with built-in AI assistance for fast code writing and editing.","zed code editor fast performance collaborative ai assist write edit pair programming","https://zed.dev/favicon.ico","https://zed.dev"
"Pieces for Developers","Coding","AI-powered developer productivity tool for capturing, organizing, and reusing code snippets with context.","pieces developer productivity code snippet capture organize reuse context ai assistant","https://pieces.app/favicon.ico","https://pieces.app"
"Bugasura","Coding","AI-enhanced bug tracking platform for development teams to report, assign, and resolve bugs efficiently.","bugasura bug track ai team report assign resolve project management development","https://bugasura.io/favicon.ico","https://bugasura.io"
"Stenography","Coding","AI tool that automatically generates documentation and code comments for any code file or repository.","stenography ai documentation generate comment code auto explain repository doc","https://stenography.dev/favicon.ico","https://stenography.dev"
"Mintlify","Coding","AI-powered documentation platform for automatically generating and maintaining beautiful developer docs.","mintlify documentation ai generate developer docs beautiful maintain code explain","https://mintlify.com/favicon.ico","https://mintlify.com"
"TestGPT","Coding","AI tool that automatically generates unit tests and test cases for code to improve software quality.","testgpt ai unit test generate code quality software automatic testing developer","https://codium.ai/favicon.ico","https://codium.ai"
"Snyk","Coding","AI-powered developer security platform finding and fixing vulnerabilities in code, dependencies, and containers.","snyk security ai vulnerability find fix code dependency container developer devsecops","https://snyk.io/favicon.ico","https://snyk.io"
"Mutable AI","Coding","AI software development platform with autocomplete, refactoring, and automated code documentation features.","mutable ai code development autocomplete refactor document software engineer assistant","https://mutable.ai/favicon.ico","https://mutable.ai"
"AskCodi","Coding","AI coding assistant for generating code, tests, and documentation across multiple programming languages.","askcodi ai coding assistant generate test documentation language program help","https://www.askcodi.com/favicon.ico","https://www.askcodi.com"
"Duet AI","Coding","Google Cloud's AI pair programmer integrated into Google Workspace and Cloud IDE for developer productivity.","duet ai google cloud pair programming workspace ide developer productivity suggest","https://cloud.google.com/favicon.ico","https://cloud.google.com/duet-ai"
"Warp","Coding","AI-powered terminal for developers with natural language command search, AI debugging, and team sharing.","warp terminal ai developer natural language command debug team share modern","https://www.warp.dev/favicon.ico","https://www.warp.dev"
"Grammarly","Writing","AI writing assistant for grammar correction, style improvements, tone suggestions, and clear communication.","grammarly writing grammar spell check edit proofread clarity text tone suggestion","https://upload.wikimedia.org/wikipedia/commons/thumb/3/31/Grammarly_logo.svg/64px-Grammarly_logo.svg.png","https://www.grammarly.com"
"Jasper AI","Writing","Enterprise AI content platform for generating SEO blogs, marketing copy, emails, and social media content.","jasper ai writing content marketing copy blog social media email seo enterprise generate","https://www.jasper.ai/favicon.ico","https://www.jasper.ai"
"Copy.ai","Writing","AI copywriting tool for generating marketing copy, product descriptions, ads, and creative content fast.","copyai writing copy content marketing product description social media ad create fast","https://www.copy.ai/favicon.ico","https://www.copy.ai"
"Writesonic","Writing","AI writing platform for generating SEO-optimized blogs, ads, landing pages, and social media posts.","writesonic ai writing seo blog ad landing page social media content generate optimize","https://writesonic.com/favicon.ico","https://writesonic.com"
"Rytr","Writing","Affordable AI writing assistant generating high-quality content in 30+ languages for any use case quickly.","rytr ai writing assistant generate content language affordable fast blog email ad","https://rytr.me/favicon.ico","https://rytr.me"
"Wordtune","Writing","AI writing companion that rephrases, rewrites, and summarizes sentences to improve clarity and impact.","wordtune writing rephrase rewrite summarize sentence clarity style improve ai text","https://www.wordtune.com/favicon.ico","https://www.wordtune.com"
"QuillBot","Writing","AI paraphrasing and summarization tool that rephrases text while preserving original meaning and style.","quillbot paraphrase summarize rewrite ai text rephrase meaning style improve writing","https://quillbot.com/favicon.ico","https://quillbot.com"
"Hemingway Editor","Writing","AI-powered writing app that highlights complex sentences, passive voice, and readability issues for cleaner prose.","hemingway editor writing readability complex sentence passive voice highlight improve prose","https://hemingwayapp.com/favicon.ico","https://hemingwayapp.com"
"ProWritingAid","Writing","Comprehensive AI writing editor checking grammar, style, readability, and overused words for authors.","prowritingaid writing editor grammar style readability author manuscript check improve","https://prowritingaid.com/favicon.ico","https://prowritingaid.com"
"Sudowrite","Writing","AI creative writing partner for fiction authors to brainstorm, expand scenes, and overcome writer's block.","sudowrite creative writing fiction ai author brainstorm scene expand block story","https://www.sudowrite.com/favicon.ico","https://www.sudowrite.com"
"NovelAI","Writing","AI storytelling subscription service for generating novels, stories, and interactive fiction with custom characters.","novelai storytelling novel story fiction interactive ai generate character creative write","https://novelai.net/favicon.ico","https://novelai.net"
"Ink for All","Writing","AI writing and SEO tool optimizing content for search engines while maintaining natural, engaging writing.","ink for all writing seo optimize content search engine natural engage score","https://inkforall.com/favicon.ico","https://inkforall.com"
"Anyword","Writing","AI copywriting platform predicting content performance scores before publishing for better marketing ROI.","anyword ai copy predict performance score marketing content seo ad blog roi","https://anyword.com/favicon.ico","https://anyword.com"
"Longshot AI","Writing","AI writing assistant creating factual, SEO-optimized long-form blog posts with verified, cited information.","longshot ai writing long form blog seo fact check cite verify content create","https://www.longshot.ai/favicon.ico","https://www.longshot.ai"
"Scalenut","Writing","AI-powered content intelligence platform for SEO research, content planning, and writing optimization.","scalenut ai content seo research plan write optimize intelligence marketing blog","https://www.scalenut.com/favicon.ico","https://www.scalenut.com"
"Frase","Writing","AI content tool for researching competitors, generating SEO briefs, and writing optimized articles efficiently.","frase ai content seo research competitor brief write article optimize efficiently","https://www.frase.io/favicon.ico","https://www.frase.io"
"Surfer SEO","Writing","AI content optimization platform analyzing top pages to guide writers in creating SEO-winning articles.","surfer seo ai content optimize analyze top page guide write article rank search","https://surferseo.com/favicon.ico","https://surferseo.com"
"Originality.ai","Writing","AI content detector and plagiarism checker identifying AI-generated text for publishers and educators.","originality ai detect content plagiarism check generated text publisher educator","https://originality.ai/favicon.ico","https://originality.ai"
"Winston AI","Writing","AI detection tool identifying ChatGPT and other AI-generated content with high accuracy for educators.","winston ai detect chatgpt generated content accuracy educator student academic check","https://gowinston.ai/favicon.ico","https://gowinston.ai"
"DeepL","Translation","Neural machine translation service providing industry-leading accuracy between 30+ languages instantly.","deepl translate language text document accuracy multilingual global neural instant","https://www.deepl.com/favicon.ico","https://www.deepl.com"
"Wordvice","Writing","AI proofreading tool offering grammar, syntax, and style corrections for academic and professional documents.","wordvice proofread ai grammar syntax style academic professional document correct","https://wordvice.ai/favicon.ico","https://wordvice.ai"
"Hyperwrite","Writing","Personal AI writing assistant learning your style to draft emails, essays, and content that sounds like you.","hyperwrite personal ai writing assistant style email essay content draft learn you","https://www.hyperwriteai.com/favicon.ico","https://www.hyperwriteai.com"
"Describely","Writing","AI product description generator for ecommerce stores, optimizing bulk product content for SEO.","describely ai product description ecommerce store seo optimize bulk generate content","https://describely.ai/favicon.ico","https://describely.ai"
"Shortly AI","Writing","Minimalist AI writing tool for long-form content creation with powerful commands to expand and rewrite text.","shortly ai writing long form create expand rewrite command minimalist focus blog","https://shortlyai.com/favicon.ico","https://shortlyai.com"
"Spinbot","Writing","Free AI text spinner and paraphrasing tool rewriting articles to create unique content quickly.","spinbot ai paraphrase spin text rewrite article unique content free fast simple","https://spinbot.com/favicon.ico","https://spinbot.com"
"LanguageTool","Writing","Open-source AI proofreader for grammar, spelling, punctuation, and style in 30+ languages.","languagetool grammar spell punctuation style proofread open source language multilingual","https://languagetool.org/favicon.ico","https://languagetool.org"
"Lex","Writing","Distraction-free AI writing editor helping writers create faster with suggestions and feedback as you type.","lex writing editor ai distraction free suggestion feedback create fast draft blog","https://lex.page/favicon.ico","https://lex.page"
"Notion AI","Productivity","AI writing and analysis assistant embedded in Notion for summarizing, drafting, and organizing knowledge.","notion ai productivity writing notes documents summarize organize workspace draft analyze","https://upload.wikimedia.org/wikipedia/commons/thumb/e/e9/Notion-logo.svg/64px-Notion-logo.svg.png","https://www.notion.so"
"Otter.ai","Productivity","AI meeting transcription and note-taking tool that records, transcribes, and summarizes conversations automatically.","otter transcribe meeting notes audio speech recording summary productivity auto real-time","https://otter.ai/favicon.ico","https://otter.ai"
"Fathom","Meeting Assistant","AI meeting recorder and summarizer that captures key moments, decisions, and action items from calls.","fathom meeting record summarize notes action items zoom teams call ai free","https://fathom.video/favicon.ico","https://fathom.video"
"Fireflies.ai","Meeting Assistant","AI meeting assistant recording, transcribing, and analyzing calls across Zoom, Teams, Meet, and Webex.","fireflies meeting transcribe record analyze notes crm integration zoom teams meet webex","https://fireflies.ai/favicon.ico","https://fireflies.ai"
"Grain","Meeting Assistant","AI meeting highlight tool that automatically captures key moments and creates shareable video clips from calls.","grain meeting highlight capture key moment share video clip zoom ai record","https://grain.com/favicon.ico","https://grain.com"
"Avoma","Meeting Assistant","AI meeting assistant with conversation intelligence providing full transcripts, summaries, and coaching insights.","avoma meeting assistant transcribe summarize coach insight conversation intelligence sales","https://www.avoma.com/favicon.ico","https://www.avoma.com"
"tl;dv","Meeting Assistant","AI tool recording and summarizing video meetings with timestamps and highlights for easy review.","tldv meeting record summarize video timestamp highlight review zoom gpt","https://tldv.io/favicon.ico","https://tldv.io"
"Reclaim AI","Productivity","AI scheduling assistant automatically finding and protecting time for tasks, habits, and meetings on your calendar.","reclaim ai schedule calendar task habit meeting protect time plan productivity","https://reclaim.ai/favicon.ico","https://reclaim.ai"
"Motion","Productivity","AI project management and scheduling tool that automatically builds your daily schedule and reprioritizes tasks.","motion ai project schedule task plan priority daily automatic calendar productivity","https://www.usemotion.com/favicon.ico","https://www.usemotion.com"
"Clockwise","Productivity","AI calendar assistant optimizing meeting schedules to protect focus time and improve team collaboration.","clockwise ai calendar optimize meeting focus time team collaboration schedule protect","https://www.getclockwise.com/favicon.ico","https://www.getclockwise.com"
"Mem","Productivity","AI note-taking app that automatically connects related ideas, notes, and tasks using knowledge graph technology.","mem notes ai connect idea knowledge graph organize automatic smart memory tag","https://get.mem.ai/favicon.ico","https://get.mem.ai"
"Taskade","Productivity","AI productivity workspace with task management, mind mapping, notes, and team collaboration in one platform.","taskade productivity task manage mind map note team collaborate ai workspace plan","https://www.taskade.com/favicon.ico","https://www.taskade.com"
"Hive","Productivity","AI-powered project management platform with automation, analytics, and integrated AI assistance for teams.","hive ai project management automate analytics team collaborate productivity workflow","https://hive.com/favicon.ico","https://hive.com"
"Beautiful.ai","Presentation","AI presentation maker that automatically designs and formats stunning professional slide decks in minutes.","beautiful ai presentation slides deck design create visual format auto stunning minute","https://www.beautiful.ai/favicon.ico","https://www.beautiful.ai"
"Tome","Presentation","AI narrative presentation tool generating complete, visually appealing decks from simple text prompts.","tome presentation slides create generate design story pitch deck narrative text","https://tome.app/favicon.ico","https://tome.app"
