"tool_name","category","description","keywords","icon_url","website_link"
"Clearscope","SEO","AI content optimization tool analyzing top-ranking pages to guide writers in producing SEO-winning content.","clearscope ai content seo optimize rank page guide writer keyword score","https://www.clearscope.io/favicon.ico","https://www.clearscope.io"
"BrightEdge","SEO","Enterprise AI SEO platform for large organizations tracking rankings, content performance, and opportunities.","brightedge enterprise seo ai rank content performance opportunity track large organization","https://www.brightedge.com/favicon.ico","https://www.brightedge.com"
"NeuronWriter","SEO","AI content editor using NLP and SERP analysis to help write, optimize, and outrank competitors.","neuronwriter ai content nlp serp analyze write optimize rank competitor seo","https://neuronwriter.com/favicon.ico","https://neuronwriter.com"
"RankMath AI","SEO","WordPress SEO plugin with AI-powered content analysis, schema markup, and search optimization suggestions.","rankmath wordpress seo ai content analyze schema markup optimize plugin search","https://rankmath.com/favicon.ico","https://rankmath.com"
"Shopify Magic","E-commerce","Shopify's suite of AI tools for writing product descriptions, creating images, and answering customer queries.","shopify magic ai product description image customer query ecommerce store write create","https://www.shopify.com/favicon.ico","https://www.shopify.com/magic"
"Visenze","E-commerce","AI visual search and product discovery platform helping shoppers find products using images instead of keywords.","visenze ai visual search product discover ecommerce image shop recommend find similar","https://www.visenze.com/favicon.ico","https://www.visenze.com"
"Nosto","E-commerce","AI personalization platform for ecommerce delivering product recommendations and personalized shopping experiences.","nosto ai personalize ecommerce product recommend experience customer shopping segment","https://www.nosto.com/favicon.ico","https://www.nosto.com"
"Dynamic Yield","E-commerce","AI-powered personalization platform for ecommerce delivering individualized product recommendations and content.","dynamic yield ai personalize ecommerce product recommend individual content experience ab test","https://www.dynamicyield.com/favicon.ico","https://www.dynamicyield.com"
"Clerk.io","E-commerce","AI search and personalization engine for ecommerce stores increasing product discovery and conversion rates.","clerk io ai search personalize ecommerce product discover convert recommend store","https://www.clerk.io/favicon.ico","https://www.clerk.io"
"Buffer AI","Social Media","AI-powered social media management platform for scheduling posts, analyzing performance, and generating captions.","buffer ai social media schedule post analyze performance caption generate manage","https://buffer.com/favicon.ico","https://buffer.com"
"Hootsuite Owly","Social Media","Hootsuite's AI writing assistant generating on-brand social media captions and hashtags for any platform.","hootsuite owly ai social media caption hashtag generate brand write schedule","https://www.hootsuite.com/favicon.ico","https://www.hootsuite.com"
"Sprout Social AI","Social Media","AI features in Sprout Social for sentiment analysis, response suggestions, and optimal post timing.","sprout social ai sentiment response suggest timing analyze manage schedule brand","https://sproutsocial.com/favicon.ico","https://sproutsocial.com"
"Lately","Social Media","AI content repurposing tool analyzing your brand voice and transforming long content into social media posts.","lately ai content repurpose brand voice transform social media post blog video audio","https://www.lately.ai/favicon.ico","https://www.lately.ai"
"Ocoya","Social Media","AI social media content creator generating captions, hashtags, and graphics for scheduling across platforms.","ocoya ai social media create caption hashtag graphic schedule platform content","https://www.ocoya.com/favicon.ico","https://www.ocoya.com"
"Vista Social","Social Media","AI-powered social media management tool with smart scheduling, AI captions, and engagement analytics.","vista social ai manage schedule smart caption engage analyze performance platform post","https://vistasocial.com/favicon.ico","https://vistasocial.com"
"Predis.ai","Social Media","AI social media post generator creating complete posts with captions, images, and video from a single idea.","predis ai social media post generate caption image video create idea quick","https://predis.ai/favicon.ico","https://predis.ai"
"Flick","Social Media","AI hashtag finder and social media scheduling tool helping creators grow their Instagram and TikTok reach.","flick ai hashtag find social media schedule instagram tiktok creator grow reach","https://www.flick.social/favicon.ico","https://www.flick.social"
"Darktrace","Cybersecurity","AI cybersecurity platform using unsupervised machine learning to detect and respond to cyber threats in real time.","darktrace ai cybersecurity threat detect respond machine learning real-time network autonomous","https://www.darktrace.com/favicon.ico","https://www.darktrace.com"
"CrowdStrike AI","Cybersecurity","AI-native cybersecurity platform using machine learning to prevent breaches, detect threats, and respond fast.","crowdstrike ai cybersecurity threat prevent detect respond machine learning endpoint breach","https://www.crowdstrike.com/favicon.ico","https://www.crowdstrike.com"
"SentinelOne","Cybersecurity","Autonomous AI cybersecurity platform protecting endpoints, cloud, and identity from advanced cyber attacks.","sentinelone ai cybersecurity autonomous endpoint cloud identity protect attack threat hunt","https://www.sentinelone.com/favicon.ico","https://www.sentinelone.com"
"Vectra AI","Cybersecurity","AI threat detection platform using behavior analysis to find attackers hiding in network and cloud traffic.","vectra ai threat detect network cloud behavior analyze attacker hide response ndr","https://www.vectra.ai/favicon.ico","https://www.vectra.ai"
"IBM QRadar AI","Cybersecurity","IBM's AI security operations platform correlating security events and accelerating threat detection and response.","ibm qradar ai security siem threat detect respond correlate event operation center soc","https://www.ibm.com/favicon.ico","https://www.ibm.com/qradar"
"Google Med-PaLM","Healthcare","Google's specialized medical AI model trained for clinical question answering and healthcare text understanding.","google med palm healthcare medical ai clinical question answer understand text health","https://health.google/favicon.ico","https://health.google/caregiving/care-at-home"
"Tempus AI","Healthcare","AI healthcare data platform analyzing clinical and molecular data to personalize cancer treatment decisions.","tempus ai healthcare cancer clinical molecular data analyze personalize treatment decision","https://www.tempus.com/favicon.ico","https://www.tempus.com"
"Nuance DAX","Healthcare","AI ambient clinical intelligence tool automatically documenting patient encounters for clinician efficiency.","nuance dax ai healthcare ambient clinical document patient encounter physician note auto","https://www.nuance.com/favicon.ico","https://www.nuance.com/healthcare/ambient-clinical-intelligence.html"
"Aidoc","Healthcare","AI medical imaging platform detecting critical findings in radiology scans to prioritize urgent patient care.","aidoc ai medical imaging radiology scan detect critical finding prioritize patient care","https://www.aidoc.com/favicon.ico","https://www.aidoc.com"
"PathAI","Healthcare","AI pathology platform improving diagnostic accuracy in cancer detection using deep learning on tissue samples.","pathai ai pathology cancer detect diagnose accuracy deep learning tissue sample microscope","https://www.pathai.com/favicon.ico","https://www.pathai.com"
"Amplitude AI","Analytics","AI product analytics platform predicting user behavior, identifying drop-offs, and optimizing product experiences.","amplitude ai analytics product user behavior predict drop-off optimize experience retention","https://amplitude.com/favicon.ico","https://amplitude.com"
"Mixpanel AI","Analytics","AI-powered product analytics platform for tracking user journeys, funnels, and retention across digital products.","mixpanel ai analytics product user journey funnel retention track digital behavior event","https://mixpanel.com/favicon.ico","https://mixpanel.com"
"Heap AI","Analytics","AI digital insights platform automatically capturing all user interactions and surfacing behavioral patterns.","heap ai analytics digital insight user interaction capture behavior pattern auto product","https://heap.io/favicon.ico","https://heap.io"
"FullStory AI","Analytics","AI behavioral data platform capturing every user session and applying AI to identify frustration and opportunity.","fullstory ai behavioral data session capture user frustration opportunity analyze digital experience","https://www.fullstory.com/favicon.ico","https://www.fullstory.com"
"Hotjar AI","Analytics","AI heatmap and session recording tool visualizing user behavior on websites to improve UX and conversions.","hotjar ai heatmap session record user behavior website ux conversion improve visualize click","https://www.hotjar.com/favicon.ico","https://www.hotjar.com"
"Contentsquare","Analytics","AI digital experience analytics platform analyzing customer journeys to optimize websites and apps.","contentsquare ai digital experience analyze customer journey optimize website app ux conversion","https://contentsquare.com/favicon.ico","https://contentsquare.com"
"AutoGPT","AI Agents","Autonomous AI agent framework executing complex multi-step tasks using GPT-4 with internet access and memory.","autogpt autonomous agent ai task multi-step internet access memory gpt execute goal","https://agpt.co/favicon.ico","https://agpt.co"
"LangChain","AI Agents","Open-source framework for building LLM-powered applications, chatbots, and autonomous AI agent pipelines.","langchain open source framework llm ai agent application chatbot pipeline build developer","https://langchain.com/favicon.ico","https://langchain.com"
"CrewAI","AI Agents","Framework for orchestrating multi-agent AI systems where specialized agents collaborate to complete complex tasks.","crewai multi agent ai orchestrate collaborate task complex system specialist framework","https://www.crewai.com/favicon.ico","https://www.crewai.com"
"AgentGPT","AI Agents","Browser-based autonomous AI agent platform deploying agents to research, plan, and execute tasks online.","agentgpt autonomous agent browser deploy research plan execute task online web ai goal","https://agentgpt.reworkd.ai/favicon.ico","https://agentgpt.reworkd.ai"
"Dify","AI Agents","Open-source LLM app development platform for building AI workflows, chatbots, and agent applications.","dify open source llm app develop ai workflow chatbot agent build platform api","https://dify.ai/favicon.ico","https://dify.ai"
"Flowise","AI Agents","Open-source drag-and-drop UI for building customized LLM orchestration flows and AI chatbot applications.","flowise open source drag drop llm orchestrate ai chatbot build custom flow node","https://flowiseai.com/favicon.ico","https://flowiseai.com"
"Relevance AI","AI Agents","No-code AI agent builder and workflow platform enabling businesses to deploy AI teams and automate tasks.","relevance ai agent builder workflow no code deploy automate business team task integrate","https://relevanceai.com/favicon.ico","https://relevanceai.com"
"Voiceflow","AI Agents","No-code platform for building, testing, and deploying conversational AI agents and voice assistants.","voiceflow no code conversational ai agent voice assistant build deploy test chatbot","https://www.voiceflow.com/favicon.ico","https://www.voiceflow.com"
"Stack AI","AI Agents","Enterprise AI workflow automation platform building AI pipelines and agents connected to business data.","stack ai enterprise workflow automate pipeline agent business data connect no code","https://www.stack-ai.com/favicon.ico","https://www.stack-ai.com"
"Dust","AI Agents","Platform for building internal AI assistants connected to company knowledge bases, tools, and data sources.","dust ai assistant internal knowledge base connect tool data source enterprise build team","https://dust.tt/favicon.ico","https://dust.tt"
"Otter.ai Sales","Sales","AI conversation intelligence tool for sales teams automatically capturing notes and next steps from calls.","otter ai sales conversation intelligence note next step capture call crm automatic","https://otter.ai/favicon.ico","https://otter.ai/for/sales"
"Pictory Shorts","Video Editing","AI tool automatically creating viral short-form video reels from long webinars, podcasts, and recordings.","pictory shorts video edit ai create viral reel webinar podcast recording clip short","https://pictory.ai/favicon.ico","https://pictory.ai"
"Durable","Design","AI website builder creating complete business websites in 30 seconds from a business description.","durable ai website build business 30 second create fast launch simple description","https://durable.co/favicon.ico","https://durable.co"
"10Web","Design","AI website builder powered by WordPress that generates and optimizes professional sites from a brief.","10web ai website build wordpress generate optimize professional site brief design","https://10web.io/favicon.ico","https://10web.io"
"Typeface","Marketing","Enterprise AI content platform for generating on-brand marketing content across channels with brand controls.","typeface enterprise ai content brand marketing generate channel control consistent voice","https://www.typeface.ai/favicon.ico","https://www.typeface.ai"
"Writer","Writing","Full-stack AI platform for enterprises deploying AI writing assistants with brand and compliance guardrails.","writer ai enterprise writing brand compliance guardrail generate content team governance","https://writer.com/favicon.ico","https://writer.com"
"Coda AI","Productivity","AI-powered doc and app platform with automation that turns spreadsheets and docs into collaborative tools.","coda ai productivity doc app automate spreadsheet collaborate tool build workflow team","https://coda.io/favicon.ico","https://coda.io"
"Rows","Research","AI-enhanced spreadsheet tool with built-in data connectors, formulas, and AI analysis using GPT.","rows ai spreadsheet data connector formula analysis gpt automate import export","https://rows.com/favicon.ico","https://rows.com"
"Bardeen Scraper","Research","AI web scraper automating data extraction from websites and populating spreadsheets and databases.","bardeen scraper ai web extract data website spreadsheet database automate populate","https://www.bardeen.ai/favicon.ico","https://www.bardeen.ai/scraper"
"Browse AI","Research","AI tool training robots to extract and monitor data from any website without writing code.","browse ai robot extract monitor data website no code scrape train automate","https://www.browse.ai/favicon.ico","https://www.browse.ai"
"Diffbot","Research","AI knowledge graph and web data extraction platform turning unstructured web content into structured data.","diffbot ai knowledge graph web data extract structure content crawl entity","https://www.diffbot.com/favicon.ico","https://www.diffbot.com"
"Magical","Productivity","AI productivity app automating repetitive typing tasks with smart text expansion and form auto-fill.","magical ai productivity type expand automate repetitive fill form text shortcut speed","https://www.getmagical.com/favicon.ico","https://www.getmagical.com"
"TextBlaze","Productivity","AI-powered text expansion tool for creating smart templates that auto-fill forms and speed up typing.","textblaze ai text expand template form fill type speed shortcut automate productivity","https://blaze.today/favicon.ico","https://blaze.today"
"Superhuman","Productivity","AI-powered email client with AI triage, reply assistance, and keyboard shortcuts for peak inbox productivity.","superhuman ai email client triage reply assist keyboard shortcut fast productivity inbox","https://superhuman.com/favicon.ico","https://superhuman.com"
"SaneBox","Productivity","AI email management tool automatically sorting important emails from distractions to maintain inbox zero.","sanebox ai email manage sort important distraction inbox zero priority filter clean","https://www.sanebox.com/favicon.ico","https://www.sanebox.com"
"Shortwave","Productivity","AI email app using AI to summarize, bundle, and draft emails for faster, more organized communication.","shortwave ai email summarize bundle draft organize fast communicate inbox manage","https://www.shortwave.com/favicon.ico","https://www.shortwave.com"
"Beehiiv AI","Marketing","AI newsletter platform with built-in tools for writing, personalizing, and optimizing email newsletter content.","beehiiv ai newsletter write personalize optimize email content publish subscribe grow","https://www.beehiiv.com/favicon.ico","https://www.beehiiv.com"
"ConvertKit AI","Marketing","Email marketing platform for creators with AI tools for writing sequences, subject lines, and automations.","convertkit ai email marketing creator write sequence subject line automate newsletter","https://convertkit.com/favicon.ico","https://convertkit.com"
"Klaviyo AI","Marketing","AI email and SMS marketing platform for e-commerce with predictive analytics and smart segmentation.","klaviyo ai email sms marketing ecommerce predict analytics segment automate personalize","https://www.klaviyo.com/favicon.ico","https://www.klaviyo.com"
"Brevo AI","Marketing","AI email marketing platform with smart segmentation, send-time optimization, and transactional email.","brevo sendInBlue ai email marketing segment optimize send time transactional sms campaign","https://www.brevo.com/favicon.ico","https://www.brevo.com"
"Mailchimp AI","Marketing","AI-powered email marketing platform with content optimizer, subject line helper, and predictive demographics.","mailchimp ai email marketing optimize content subject line predict demographic segment campaign","https://mailchimp.com/favicon.ico","https://mailchimp.com"
"DeepL","Translation","Neural machine translation delivering the most accurate translations in 30+ languages for documents and text.","deepl translate language text document accuracy multilingual global neural instant professional","https://www.deepl.com/favicon.ico","https://www.deepl.com"
"Google Translate","Translation","Google's free AI translation service supporting 130+ languages with text, voice, image, and document translation.","google translate language ai free 130 text voice image document translate","https://translate.google.com/favicon.ico","https://translate.google.com"
"Amazon Translate","Translation","Neural machine translation service from AWS for fast, high-quality, affordable language translation at scale.","amazon translate aws neural machine language translation fast quality scale api cloud","https://aws.amazon.com/favicon.ico","https://aws.amazon.com/translate"
"Reverso","Translation","AI translation and language learning tool with context examples, conjugation, and bilingual dictionaries.","reverso translate language learn context example conjugate dictionary bilingual grammar","https://www.reverso.net/favicon.ico","https://www.reverso.net"
"Smartling","Translation","Enterprise AI translation management platform automating localization workflows for global businesses.","smartling enterprise ai translate localize manage workflow global business automate scale","https://www.smartling.com/favicon.ico","https://www.smartling.com"
"Loom AI","Meeting Assistant","AI-enhanced async video messaging with automatic summaries and action items from recorded videos.","loom ai video message async summary action item record team communicate async","https://www.loom.com/favicon.ico","https://www.loom.com"
"Zoom AI Companion","Meeting Assistant","Zoom's built-in AI for generating meeting summaries, suggesting replies, and capturing action items automatically.","zoom ai companion meeting summary reply suggest action item capture auto companion","https://zoom.us/favicon.ico","https://zoom.us/ai-companion"
"Microsoft Copilot Teams","Meeting Assistant","AI assistant in Microsoft Teams summarizing meetings, drafting messages, and surfacing insights from chats.","microsoft copilot teams meeting summary message draft insight chat ai companion m365","https://teams.microsoft.com/favicon.ico","https://www.microsoft.com/microsoft-teams/copilot"
"Sembly AI","Meeting Assistant","AI meeting assistant supporting multi-language transcription, smart notes, and task extraction from calls.","sembly ai meeting transcribe multi-language smart note task extract summary call","https://www.sembly.ai/favicon.ico","https://www.sembly.ai"
"Notta","Meeting Assistant","AI transcription and summarization tool converting audio, video, and meetings into searchable text notes.","notta ai transcribe summarize audio video meeting note text search multilingual","https://www.notta.ai/favicon.ico","https://www.notta.ai"
"Runway Gen-3","Video Generation","Runway's latest foundation model for generating highly cinematic and consistent video from text or images.","runway gen 3 video generate cinematic consistent text image alpha ai foundation model","https://runwayml.com/favicon.ico","https://runwayml.com/research/introducing-gen-3-alpha"
"Kaiber","Video Generation","AI animation tool creating music videos, animations, and artistic video content from images or audio.","kaiber ai animation create music video art visual image audio generate artistic","https://kaiber.ai/favicon.ico","https://kaiber.ai"
"Genmo","Video Generation","AI video and animation generation platform creating motion clips and animated content from text prompts.","genmo ai video animation create motion clip animate text prompt generate art","https://www.genmo.ai/favicon.ico","https://www.genmo.ai"
"PixVerse","Video Generation","AI video generation platform creating high-quality cinematic clips and animations from text and images.","pixverse ai video generate cinematic clip animate text image create quality","https://pixverse.ai/favicon.ico","https://pixverse.ai"
"Stable Video Diffusion","Video Generation","Stability AI's open-source model for generating short high-quality video clips from single image inputs.","stable video diffusion stability ai open source image video generate clip animate","https://stability.ai/favicon.ico","https://stability.ai/news/stable-video-diffusion-open-ai-video-model"
"Hotpot AI","Design","Suite of AI creative tools for photo editing, image generation, colorizing photos, and creating artwork.","hotpot ai design photo edit image generate colorize art create enhance tool suite","https://hotpot.ai/favicon.ico","https://hotpot.ai"
"Runway Inpainting","Image Editing","AI image editing feature allowing users to remove objects or fill areas naturally using AI generative fill.","runway inpainting ai image edit remove object fill area generative natural brush","https://runwayml.com/favicon.ico","https://runwayml.com"
"Adobe Generative Fill","Image Editing","Photoshop's AI-powered generative fill feature adding, removing, and extending image content seamlessly.","adobe photoshop generative fill ai image edit add remove extend seamless firefly","https://www.adobe.com/favicon.ico","https://www.adobe.com/products/photoshop/generative-fill.html"
"Pixlr AI","Image Editing","Online AI photo editor with background removal, AI fill, cutout, and image generation tools.","pixlr ai photo edit background remove fill cutout generate online free enhance","https://pixlr.com/favicon.ico","https://pixlr.com"
"BeFunky","Design","AI-powered photo editor and graphic design platform with collage maker and creative design templates.","befunky ai photo edit graphic design collage template create enhance portrait filter","https://www.befunky.com/favicon.ico","https://www.befunky.com"
"Claude Code","Coding","Anthropic's AI coding tool for agentic software development directly in the command line terminal.","claude code anthropic ai coding agentic terminal command line cli developer agent","https://upload.wikimedia.org/wikipedia/commons/thumb/8/8a/Claude_AI_logo.svg/64px-Claude_AI_logo.svg.png","https://claude.ai/code"
"Gemini Code Assist","Coding","Google's AI code completion and generation tool integrated into popular IDEs and Google Cloud workflows.","gemini code assist google ai complete generate ide cloud workflow developer suggest","https://cloud.google.com/favicon.ico","https://cloud.google.com/gemini/docs/discover/code-with-gemini"
"JetBrains AI","Coding","AI coding assistant built into JetBrains IDEs providing smart code completion, generation, and refactoring.","jetbrains ai code complete generate refactor ide intelligent smart developer assist plugin","https://www.jetbrains.com/favicon.ico","https://www.jetbrains.com/ai"
"Blackbox AI","Coding","AI coding assistant for code completion, searching code from web, and generating boilerplate code fast.","blackbox ai code complete search generate boilerplate fast chat program assist developer","https://www.useblackbox.io/favicon.ico","https://www.useblackbox.io"
"CodeT5","Coding","Salesforce's open-source code generation and understanding AI model supporting multiple programming languages.","codet5 salesforce code generate understand open source model language ai programming ml","https://www.salesforce.com/favicon.ico","https://github.com/salesforce/CodeT5"
"Codiga","Coding","AI code analysis platform checking for security vulnerabilities, bugs, and code quality issues automatically.","codiga ai code analyze security vulnerability bug quality check automatic static analysis","https://www.codiga.io/favicon.ico","https://www.codiga.io"
