"tool_name","category","description","keywords","icon_url","website_link"
"ChatGPT","Text Generation","Advanced conversational AI for writing, coding, analysis, and answering complex questions with high accuracy.","chatgpt text writing chat conversation language gpt openai assistant nlp","https://upload.wikimedia.org/wikipedia/commons/thumb/0/04/ChatGPT_logo.svg/64px-ChatGPT_logo.svg.png","https://chat.openai.com"
"Claude","Text Generation","Anthropic's AI assistant for nuanced writing, analysis, coding, and thoughtful conversations with safety focus.","claude anthropic text writing analysis chat assistant conversation reasoning","https://upload.wikimedia.org/wikipedia/commons/thumb/8/8a/Claude_AI_logo.svg/64px-Claude_AI_logo.svg.png","https://claude.ai"
"Gemini","Text Generation","Google's multimodal AI for text, image, and code tasks with deep Google integration and real-time search.","gemini google text image multimodal assistant chat analysis bard real-time","https://upload.wikimedia.org/wikipedia/commons/thumb/8/8a/Google_Gemini_logo.svg/64px-Google_Gemini_logo.svg.png","https://gemini.google.com"
"Meta AI","Text Generation","Meta's free AI assistant powered by Llama for chat, image generation, and real-time search across Meta apps.","meta ai llama facebook instagram whatsapp chat assistant free","https://ai.meta.com/favicon.ico","https://ai.meta.com"
"Mistral AI","Text Generation","Open and efficient large language models for text generation, coding, and reasoning tasks.","mistral ai language model open source text generation reasoning europe","https://mistral.ai/favicon.ico","https://mistral.ai"
"Cohere","Text Generation","Enterprise-grade language AI platform for text generation, summarization, classification, and semantic search.","cohere enterprise text generate summarize classify embed search nlp","https://cohere.com/favicon.ico","https://cohere.com"
"Inflection Pi","Text Generation","Empathetic personal AI assistant designed for natural, supportive conversations and emotional intelligence.","pi inflection personal assistant empathetic conversation support mental wellbeing","https://pi.ai/favicon.ico","https://pi.ai"
"Perplexity AI","Research","AI-powered search engine that provides accurate, sourced answers to complex research questions in real time.","perplexity search research answer question information browse internet cite","https://www.perplexity.ai/favicon.ico","https://www.perplexity.ai"
"You.com","Research","AI search engine combining web search with AI-generated answers, code execution, and image generation.","you.com search ai answer web research code image generate","https://you.com/favicon.ico","https://you.com"
"Phind","Coding","AI search engine tailored for developers to find coding solutions, documentation, and technical answers fast.","phind developer search code programming technical answer documentation","https://www.phind.com/favicon.ico","https://www.phind.com"
"Poe","Text Generation","Aggregator platform to chat with multiple AI models including ChatGPT, Claude, Gemini, and custom bots.","poe chatbot aggregator gpt claude gemini multiple model conversation","https://poe.com/favicon.ico","https://poe.com"
"HuggingChat","Text Generation","Open-source ChatGPT alternative powered by Hugging Face running community LLMs for free.","huggingchat open source llm chat free community alternative gpt","https://huggingface.co/favicon.ico","https://huggingface.co/chat"
"Grok","Text Generation","xAI's conversational AI with real-time access to X (Twitter) data for current events and witty responses.","grok xai twitter x real-time current events humor sarcasm chat","https://x.ai/favicon.ico","https://x.ai/grok"
"Character.ai","Chatbot","Platform for creating and chatting with AI personas, fictional characters, celebrities, and custom bots.","character ai chat persona bot roleplay conversation fictional avatar custom","https://character.ai/favicon.ico","https://character.ai"
"Kuki","Chatbot","Award-winning conversational AI chatbot for engaging entertainment, companionship, and brand experiences.","kuki chatbot conversation entertainment companion brand engage fun","https://www.kuki.ai/favicon.ico","https://www.kuki.ai"
"Replika","Chatbot","AI companion app for meaningful conversations, emotional support, and personal growth through daily interaction.","replika companion ai emotional support conversation personal mental wellness","https://replika.com/favicon.ico","https://replika.com"
"Chai AI","Chatbot","Mobile platform for chatting with AI-powered characters and creating custom chatbot personalities.","chai ai chatbot mobile character create conversation personality","https://www.chai-research.com/favicon.ico","https://www.chai-research.com"
"Llama","Text Generation","Meta's open-source large language model family available for local deployment and fine-tuning.","llama meta open source language model local deploy fine-tune weights","https://ai.meta.com/favicon.ico","https://ai.meta.com/llama"
"Ollama","Text Generation","Tool for running large language models locally on your machine with simple command-line interface.","ollama local llm run model offline privacy command line desktop","https://ollama.com/favicon.ico","https://ollama.com"
"LM Studio","Text Generation","Desktop application for discovering, downloading, and running LLMs locally on Mac, Windows, and Linux.","lm studio local llm desktop app offline run chat privacy mac windows","https://lmstudio.ai/favicon.ico","https://lmstudio.ai"
"Groq","Text Generation","Ultra-fast AI inference platform delivering tokens at record speed using custom LPU hardware.","groq fast inference llm speed token language model api hardware","https://groq.com/favicon.ico","https://groq.com"
"Together AI","AI Platform","Cloud platform for running and fine-tuning open-source AI models with fast inference at low cost.","together ai cloud platform open source model inference fine-tune cheap api","https://www.together.ai/favicon.ico","https://www.together.ai"
"Fireworks AI","AI Platform","Fast inference API for open-source language and image models with developer-friendly deployment tools.","fireworks ai inference api fast open source model deploy developer","https://fireworks.ai/favicon.ico","https://fireworks.ai"
"Anyscale","AI Platform","Platform for scalable AI model training, fine-tuning, and serving built on Ray distributed computing.","anyscale ray scale train fine-tune serve model distributed compute","https://www.anyscale.com/favicon.ico","https://www.anyscale.com"
"Scale AI","AI Platform","Data labeling and AI model evaluation platform for training high-quality machine learning models.","scale ai data label annotation training evaluation dataset quality ml","https://scale.com/favicon.ico","https://scale.com"
"Weights & Biases","AI Platform","MLOps platform for tracking experiments, versioning datasets, and monitoring ML model performance.","wandb weights biases mlops experiment tracking model monitor dashboard","https://wandb.ai/favicon.ico","https://wandb.ai"
"Neptune.ai","AI Platform","Metadata store for ML experiments featuring run tracking, model registry, and team collaboration.","neptune ai experiment tracking ml model registry metadata collaboration","https://neptune.ai/favicon.ico","https://neptune.ai"
"Hugging Face","AI Platform","Open-source AI community and platform for sharing, discovering, and running models and datasets.","hugging face model ai machine learning open source dataset hub nlp transformers","https://huggingface.co/favicon.ico","https://huggingface.co"
"Replicate","AI Platform","Cloud platform for running open-source machine learning models via simple API calls without infrastructure.","replicate model api machine learning open source run deploy cloud no infra","https://replicate.com/favicon.ico","https://replicate.com"
"Modal","AI Platform","Serverless cloud platform for running Python functions and ML workloads at scale with GPU access.","modal serverless cloud python ml gpu scale deploy function compute","https://modal.com/favicon.ico","https://modal.com"
"Midjourney","Image Generation","Powerful AI art generator creating stunning high-quality artistic images from text prompts via Discord.","midjourney image art generate create visual design illustration prompt artistic","https://upload.wikimedia.org/wikipedia/commons/thumb/e/e6/Midjourney_Emblem.png/64px-Midjourney_Emblem.png","https://www.midjourney.com"
"DALL-E 3","Image Generation","OpenAI's latest image generation model that creates highly detailed and accurate images from text descriptions.","dalle openai image generate create art visual illustration design photo realistic","https://upload.wikimedia.org/wikipedia/commons/thumb/0/04/ChatGPT_logo.svg/64px-ChatGPT_logo.svg.png","https://openai.com/dall-e-3"
"Stable Diffusion","Image Generation","Leading open-source AI image synthesis model for generating photorealistic images, art, and editing.","stable diffusion image generate art create visual design photo realistic open source","https://upload.wikimedia.org/wikipedia/commons/thumb/6/66/Stability_AI_logo.svg/64px-Stability_AI_logo.svg.png","https://stability.ai"
"Adobe Firefly","Image Generation","Adobe's AI image generator integrated with Creative Cloud for professional-grade creative design workflows.","adobe firefly image generate art design creative photo illustration edit cc cloud","https://www.adobe.com/favicon.ico","https://firefly.adobe.com"
"Ideogram","Image Generation","AI image generator excelling at embedding accurate, readable text inside generated images and artwork.","ideogram image generate text inside art typography design accurate readable","https://ideogram.ai/favicon.ico","https://ideogram.ai"
"Leonardo AI","Image Generation","AI art platform for generating consistent characters, game assets, and product-ready creative visuals.","leonardo ai image generate art game asset character design consistent style","https://leonardo.ai/favicon.ico","https://leonardo.ai"
"Playground AI","Image Generation","Free AI image generation platform mixing different models for creative art with social sharing features.","playground ai image generate art free social mix model creative fun","https://playgroundai.com/favicon.ico","https://playgroundai.com"
"Tensor Art","Image Generation","Web-based AI art generation platform with model hosting and community sharing for stable diffusion models.","tensor art ai image generate stable diffusion model host community web","https://tensor.art/favicon.ico","https://tensor.art"
"NightCafe","Image Generation","AI art creation platform with multiple generation algorithms, daily challenges, and active creator community.","nightcafe ai art image generate algorithm community challenge create style","https://nightcafe.studio/favicon.ico","https://nightcafe.studio"
"DreamStudio","Image Generation","Stability AI's official web interface for Stable Diffusion with fine-grained control over image generation.","dreamstudio stability ai stable diffusion image generate control prompt web","https://stability.ai/favicon.ico","https://dreamstudio.ai"
"Bing Image Creator","Image Generation","Microsoft's free AI image generator powered by DALL-E 3 integrated into Bing and Edge browser.","bing image creator microsoft free dalle generate art browse edge copilot","https://www.bing.com/favicon.ico","https://www.bing.com/images/create"
"Canva AI","Design","AI-enhanced graphic design platform for creating professional visuals, social media content, and presentations.","canva design graphic image presentation marketing template visual create social","https://upload.wikimedia.org/wikipedia/commons/thumb/b/bb/Canva_Logo.svg/64px-Canva_Logo.svg.png","https://www.canva.com"
"Krea AI","Image Generation","Real-time AI image generation and enhancement platform for designers with live preview and upscaling.","krea ai image generate real-time enhance upscale design live preview create","https://www.krea.ai/favicon.ico","https://www.krea.ai"
"Getimg.ai","Image Generation","Suite of AI image tools including generation, editing, inpainting, outpainting, and face restoration.","getimg ai image generate edit inpaint outpaint face restore suite tool","https://getimg.ai/favicon.ico","https://getimg.ai"
"Lexica","Image Generation","AI art search engine and Stable Diffusion image generation platform with prompt exploration features.","lexica stable diffusion search prompt explore art image generate discover","https://lexica.art/favicon.ico","https://lexica.art"
"BlueWillow","Image Generation","Free AI image generator offering high-quality art creation similar to Midjourney via Discord community.","bluewillow ai image generate free discord community art midjourney alternative","https://www.bluewillow.ai/favicon.ico","https://www.bluewillow.ai"
"Artbreeder","Image Generation","Collaborative AI art tool for blending and evolving images using genetic algorithms and style mixing.","artbreeder blend evolve mix image ai art collaborate genetic portrait style","https://www.artbreeder.com/favicon.ico","https://www.artbreeder.com"
"Deep Dream Generator","Image Generation","Google's Deep Dream art generator that creates trippy, psychedelic images from photos using neural networks.","deep dream generator google neural art psychedelic trippy photo transform style","https://deepdreamgenerator.com/favicon.ico","https://deepdreamgenerator.com"
"Fotor AI","Image Generation","All-in-one AI photo editor and image generator with background removal, enhancer, and design tools.","fotor ai photo edit generate enhance background remove design portrait tool","https://www.fotor.com/favicon.ico","https://www.fotor.com"
"StarryAI","Image Generation","Mobile AI art generator app creating artwork from text prompts with full ownership of generated images.","starryai mobile app art image generate text prompt ownership nft create","https://starryai.com/favicon.ico","https://starryai.com"
"Craiyon","Image Generation","Free AI image generator (formerly DALL-E mini) for creating quirky images from any text description.","craiyon dalle mini free image generate text art fun quirky simple","https://www.craiyon.com/favicon.ico","https://www.craiyon.com"
"Stablecog","Image Generation","Free, open-source AI image generator using Stable Diffusion with multilingual support and fast generation.","stablecog open source stable diffusion free multilingual image generate fast","https://stablecog.com/favicon.ico","https://stablecog.com"
"Dzine","Design","AI-powered graphic design tool for generating branded social media graphics, ads, and marketing visuals.","dzine ai graphic design brand social media ads marketing visual generate","https://www.dzine.ai/favicon.ico","https://www.dzine.ai"
"Patterned AI","Design","AI tool for generating seamless, tileable patterns for fabric, wallpaper, and surface design.","patterned ai pattern generate seamless tile fabric wallpaper surface design textile","https://www.patterned.ai/favicon.ico","https://www.patterned.ai"
"Clipdrop","Image Editing","Suite of AI image editing tools including background removal, cleanup, relight, and image upscaling.","clipdrop ai image edit background remove cleanup relight upscale enhance suite","https://clipdrop.co/favicon.ico","https://clipdrop.co"
"Remove.bg","Image Editing","AI-powered background removal tool that automatically detects and removes image backgrounds in seconds.","remove background image editing photo cutout transparent foreground automatic","https://www.remove.bg/favicon.ico","https://www.remove.bg"
"Photoroom","Image Editing","AI photo editor for removing backgrounds, creating product photos, and designing marketing visuals instantly.","photoroom ai photo edit background remove product marketing ecommerce instant","https://www.photoroom.com/favicon.ico","https://www.photoroom.com"
"Magic Eraser","Image Editing","AI tool for removing unwanted objects, people, and blemishes from photos with a simple brush stroke.","magic eraser remove object photo ai erase blemish clean edit unwanted","https://magicstudio.com/favicon.ico","https://magicstudio.com/magiceraser"
"Lensa AI","Image Editing","AI photo editor and avatar creator generating artistic portraits and stylized profile pictures from selfies.","lensa ai photo edit avatar portrait selfie artistic style magic profile","https://prisma-ai.com/favicon.ico","https://prisma-ai.com/lensa"
"Remini","Image Editing","AI photo enhancer that restores old, blurry, and low-quality photos to sharp HD quality using deep learning.","remini ai photo enhance restore old blurry hd quality upscale sharpen","https://remini.ai/favicon.ico","https://remini.ai"
"Topaz Photo AI","Image Editing","Professional AI photo enhancer for noise reduction, sharpening, and upscaling photos to ultra-high resolution.","topaz photo ai enhance denoise sharpen upscale resolution professional photography","https://www.topazlabs.com/favicon.ico","https://www.topazlabs.com/topaz-photo-ai"
"Let's Enhance","Image Editing","AI image upscaling service that increases resolution up to 16x while preserving natural details and textures.","lets enhance upscale image resolution quality ai detail texture increase","https://letsenhance.io/favicon.ico","https://letsenhance.io"
"Icons8","Design","AI-powered platform offering icons, illustrations, photos, and a smart icon generator for designers.","icons8 icon illustration photo design generate ai asset resource smart","https://icons8.com/favicon.ico","https://icons8.com"
"Vectorizer AI","Design","Automatically converts raster images like PNG and JPEG into clean, scalable SVG vector graphics using AI.","vectorizer ai svg vector convert raster png jpeg image scalable clean graphic","https://vectorizer.ai/favicon.ico","https://vectorizer.ai"
"Flair AI","Design","AI design tool for creating branded product photos and marketing visuals with customizable lifestyle scenes.","flair ai design product photo branded marketing lifestyle scene ecommerce visual","https://flair.ai/favicon.ico","https://flair.ai"
"Runway ML","Video Generation","Professional AI video generation and editing platform with Gen-2 for text-to-video and image animation.","runway video generate create edit film production movie animation text image","https://runwayml.com/favicon.ico","https://runwayml.com"
"Pika Labs","Video Generation","AI video generation tool that converts text and image prompts into high-quality animated video clips.","pika video generate create animate text to video image to video clip","https://www.pika.art/favicon.ico","https://www.pika.art"
"Synthesia","Video Generation","AI video creation platform using photorealistic digital avatars to produce corporate and training videos.","synthesia avatar video generate create training presentation corporate spokesperson","https://www.synthesia.io/favicon.ico","https://www.synthesia.io"
"HeyGen","Video Generation","AI video platform for creating presenter videos with realistic human avatars in 40+ languages.","heygen avatar video generate create presenter spokesperson translate multilingual","https://www.heygen.com/favicon.ico","https://www.heygen.com"
"Sora","Video Generation","OpenAI's groundbreaking text-to-video model generating minute-long photorealistic cinematic video clips.","sora openai video generate create text to video cinematic photorealistic long","https://upload.wikimedia.org/wikipedia/commons/thumb/0/04/ChatGPT_logo.svg/64px-ChatGPT_logo.svg.png","https://sora.com"
"Kling AI","Video Generation","Chinese AI video generation model producing high-quality 2-minute videos from text or image prompts.","kling ai video generate create text image 2 minute long high quality chinese","https://klingai.com/favicon.ico","https://klingai.com"
"Hailuo AI","Video Generation","MiniMax's AI video generator creating realistic, high-quality short video clips from text descriptions.","hailuo ai minimax video generate create text realistic short clip quality","https://hailuoai.com/favicon.ico","https://hailuoai.com"
"Luma Dream Machine","Video Generation","Luma AI's fast text-to-video model generating realistic, physically accurate video clips from prompts.","luma dream machine video generate create text realistic physical accurate fast","https://lumalabs.ai/favicon.ico","https://lumalabs.ai/dream-machine"
"Invideo AI","Video Generation","AI video creation platform that turns text scripts into fully produced videos with stock footage and voiceover.","invideo ai video create script stock footage voiceover produce automated text","https://invideo.io/favicon.ico","https://invideo.io"
"Pictory","Video Editing","AI video creation tool that transforms long blog articles and scripts into short engaging social video clips.","pictory video create edit clip article script social media content blog auto","https://pictory.ai/favicon.ico","https://pictory.ai"
"Descript","Video Editing","AI-powered video and podcast editor where you edit video by editing the transcript text like a document.","descript video edit podcast audio transcribe overdub record production text edit","https://www.descript.com/favicon.ico","https://www.descript.com"
"CapCut","Video Editing","Popular AI video editor with auto captions, background removal, templates, and viral social media effects.","capcut video edit ai caption background remove template social tiktok effect auto","https://www.capcut.com/favicon.ico","https://www.capcut.com"
"Veed.io","Video Editing","Online video editor with AI tools for auto subtitles, noise removal, translation, and eye contact correction.","veed video edit online subtitle noise remove translate eye contact ai tool","https://www.veed.io/favicon.ico","https://www.veed.io"
"OpusClip","Video Editing","AI tool that automatically clips long videos into viral short-form content for TikTok, Reels, and Shorts.","opusclip clip video short form viral tiktok reels youtube shorts auto ai","https://www.opus.pro/favicon.ico","https://www.opus.pro"
"Vidyo.ai","Video Editing","AI-powered platform to repurpose long videos into short branded clips with captions and social templates.","vidyo ai video repurpose short clip brand caption social template reels shorts","https://vidyo.ai/favicon.ico","https://vidyo.ai"
"Fliki","Video Generation","Text-to-video platform converting blog posts and scripts into videos with AI voices and stock media.","fliki text video blog script ai voice stock media convert create social","https://fliki.ai/favicon.ico","https://fliki.ai"
"Steve AI","Video Generation","AI video maker converting text scripts into animated or live videos with voiceover for businesses.","steve ai video create animate text script voiceover business explainer","https://www.steve.ai/favicon.ico","https://www.steve.ai"
"Animoto","Video Editing","Drag-and-drop video maker with AI-powered templates for creating professional marketing and social videos.","animoto video create drag drop template marketing social professional easy","https://animoto.com/favicon.ico","https://animoto.com"
"Topaz Video AI","Video Editing","Professional AI video enhancer for upscaling, denoising, stabilizing, and increasing frame rate of footage.","topaz video ai enhance upscale denoise stabilize frame rate fps professional","https://www.topazlabs.com/favicon.ico","https://www.topazlabs.com/topaz-video-ai"
"Wisecut","Video Editing","Automatic video editor that removes silences, adds subtitles, and creates short clips from long recordings.","wisecut video edit automatic silence remove subtitle clip short long ai","https://www.wisecut.video/favicon.ico","https://www.wisecut.video"
"D-ID","Video Generation","AI platform creating interactive digital human avatars that speak, respond, and engage in real time.","d-id digital human avatar speak interact real-time video generate face animate","https://www.d-id.com/favicon.ico","https://www.d-id.com"
"Hour One","Video Generation","Enterprise AI video platform for creating training, e-learning, and internal communication videos with avatars.","hour one ai video enterprise training elearning avatar corporate communication","https://hourone.ai/favicon.ico","https://hourone.ai"
"Colossyan","Video Generation","AI video creator for learning and development teams using diverse avatar presenters and auto-translation.","colossyan ai video learning development avatar translate diverse presenter corporate","https://www.colossyan.com/favicon.ico","https://www.colossyan.com"
"Captions","Video Editing","AI video editor adding animated captions, eye contact correction, and studio effects to talking head videos.","captions ai video edit caption animate eye contact studio effect talking head","https://www.captions.ai/favicon.ico","https://www.captions.ai"
"Munch","Video Editing","AI tool extracting the most engaging clips from long videos for repurposing across social media platforms.","munch ai video clip extract engage repurpose social media long short content","https://www.getmunch.com/favicon.ico","https://www.getmunch.com"
"ElevenLabs","Audio Generation","State-of-the-art AI voice synthesis for ultra-natural text-to-speech, voice cloning, and dubbing.","elevenlabs voice audio speech synthesize clone tts narration podcast dub realistic","https://elevenlabs.io/favicon.ico","https://elevenlabs.io"
"Murf AI","Audio Generation","Professional AI voice generator for creating lifelike voiceovers for videos, podcasts, and e-learning.","murf voice audio tts voiceover speech narration podcast video elearning realistic","https://murf.ai/favicon.ico","https://murf.ai"
"Udio","Audio Generation","AI music generation tool that creates full original songs with vocals from text prompts across all genres.","udio music audio generate create compose song genre melody vocal full track","https://www.udio.com/favicon.ico","https://www.udio.com"
